<?xml version="1.0"?>
<?xml-stylesheet type="text/css" href="xmlpartsstyle.css"?>
<etlJob xmlns="uri:etlFramework:workflow:0.1" xmlns:xsi="http://www.w3.org/2001/XMLSchema-instance"
        xsi:schemaLocation="uri:etlFramework:workflow:0.1 ../../etl_job_conf/etl_feed_job.xsd">
    <jobStaticParam jobName="job-name" frequency="DAILY" publishStats="false">
        <otherParams>
            <param order="1" name="param1" value="value1" defaultValue="value1"/>
            <param order="2" name="param2" value="value2" defaultValue="value2"/>
        </otherParams>
    </jobStaticParam>

    <extract>
        <feed feedName="json_data" validateExtractedData="false">
            <fileSystem fileType="JSON">
                <dataPath>
                    <pathPattern>
                        <initialPath>{json-file-path-suffix}</initialPath>
                        <groupPattern>
                            <member>
                                <order>1</order>
                                <catalogNamePattern>group_%s</catalogNamePattern>
                                <formatCatalogName>true</formatCatalogName>
                                <formatArgValues>
                                    <param order="1" name="abc" value="group" defaultValue="group"/>
                                </formatArgValues>
                            </member>
                        </groupPattern>
                        <feedPattern>
                            <feedNamePattern>feed_%s</feedNamePattern>
                            <formatFeedName>true</formatFeedName>
                            <formatArgValues>
                                <param order="1" name="xyz" value="json" defaultValue="json"/>
                            </formatArgValues>
                        </feedPattern>
                        <fileName>
                            <prefix>json_data</prefix>
                            <suffix>json</suffix>
                        </fileName>
                    </pathPattern>
                </dataPath>
            </fileSystem>
        </feed>
    </extract>

    <transform>
        <step order="1">
            <rule type="FILTER" group='1'>
                <condition>{col1} like 'my%'</condition>
            </rule>
        </step>

        <step order="1">
            <rule type="SELECT" group='1'>
                <condition>{col2}, {col3}, {col4}, {col5}</condition>
            </rule>
        </step>

        <step order="1">
            <rule type="SELECT" group='1'>
                <condition>{col2}, {col3}, {col4}, {col5}</condition>
            </rule>
        </step>

        <step order="1">
            <rule type="SCHEMA_TRANSFORMATION" group="1" failedFieldLimit="10" failedRowLimit="10"/>
        </step>
    </transform>

    <load>
        <feed name="json_data">
            <fileSystem fileType="JSON">
                <dataPath>
                    <path>{path}</path>
                </dataPath>
            </fileSystem>
        </feed>
    </load>
</etlJob>